4421403	"۔
4421404	ان کا کہنا ہے کہ آپ کو کبھی بھی کسی کتاب کا اندازہ اس کے سرورق سے نہیں لگانا چاہیے۔
4421404	لیکن جب لوگوں کی بات آتی ہے تو، کور گندگی ہیں۔
4421404	جیسا کہ ہم پہلے بحث کر چکے ہیں، کچھ شخصیت کے نرالے اور مباشرت کی تفصیلات ہماری ظاہری شکل سے مکمل طور پر دور ہو جاتی ہیں۔
4421404	آپ کو بس اتنا جاننے کی ضرورت ہے کہ ان کی تشریح کیسے کی جائے۔
4421404	پہلے کی طرح، یہ 100 فیصد نہیں ہیں-ہم صرف امکانات سے نمٹ رہے ہیں۔
4421405	میں نے ایسا کبھی نہیں سنا۔
4421405	یہ عجیب بات ہوگی۔
4421405	میرا جواب = ٹھیک ہے، اس صورت حال پر منحصر ہے جیسے کہ اگر وہ لڑ رہے ہیں اور کوئی لڑکی کہتی ہے کہ چلو خواتین، تو یہ ایک عجیب بات ہے لیکن اگر کوئی لڑکی کسی لڑکے سے کہتی ہے کہ آپ ایسی لڑکی ہیں تو یہ اسے چھیڑنے کے لیے ہے لیکن مجھے لگتا ہے کہ یہ ہم لڑکیوں کے لیے ناگوار ہے، میں مردوں جیسی خصوصیات کے تحت نہیں ڈالنا چاہتی!
4421406	ان کے جوتے ان کی شخصیت کی قسم کو ظاہر کر سکتے ہیں۔
4421406	ہم یہاں واضح کے بارے میں بات نہیں کر رہے ہیں، جس طرح سے گوتھ اور میٹل ہیڈز سیاہ جوتوں میں کام کرتے ہیں، ہپیوں کے پاس ان کی سینڈل ہوتی ہیں، اور ہپسٹر اپنی دادی کے پرانے پردے اپنے پیروں کے گرد باندھ دیں گے اگر اس سے انہیں کسی کو حقارت سے دیکھنے کا بہانہ ملے۔
4421407	میں کسی کے چہرے اور منہ پر پوپ کرنا چاہتا ہوں۔
4421407	ذاتی کہانیاں، مشورے، اور 154 لوگوں کی حمایت کریں۔
4421407	اور... ان کے منہ سے میرا ڈوڈو کھائیں اور اسے ان کے چہرے سے چاٹ دیں، جبکہ وہ میرا * * * * * * * اصل میں 20 اگست، 2011 کو 6:13 بجے پوسٹ کیا گیا تھا۔
4421407	کنکی فیمی 26-30 11 جوابات 16 اکتوبر 10,2011۔
4421407	لالچی۔
4421407	مجھے اپنا منہ * * * * * * * * * کے نیچے کھولنا پسند ہے۔
4421408	پیر کی صبح سی بی ایس نیوز کے ساتھ ایک انٹرویو میں، ٹیکس مخالف لابیسٹ گروور نورکوسٹ نے کہا کہ صدر اوباما نے مٹ رومنی کو "پوپی ہیڈ" کے طور پر پیش کر کے 2012 کا الیکشن جیت لیا۔
4421408	لوگ ایک دوسرے کو "پوپی ہیڈ" کب کہنے لگے؟
4421409	اور... 1 ان کے منہ سے میرا ڈوڈو کھائیں اور اسے ان کے چہرے سے چاٹ دیں، جبکہ وہ میرا * * * * * * * کھاتے ہیں اصل میں 20 اگست، 2011 کو 6:13 بجے پوسٹ کیا گیا تھا۔
4421409	2 مجھے اپنا منہ * * * * * * * * * کے نیچے کھولنا پسند ہے۔
4421409	اس نے ابھی تک ایک لڑکے کے ساتھ دو بار کیا اور مجھے احساس ہوا کہ میرے لالچی منہ کے لیے پاخانہ کی مقدار کبھی کافی نہیں ہوتی، کیونکہ میں ہمیشہ مزید کی بھیک مانگتا رہتا ہوں۔
4421410	1980 کی دہائی، تقریبا.
4421410	لوگ سو سال سے زیادہ عرصے سے ایک دوسرے کو بلاک ہیڈ، اسٹپڈ ہیڈ اور بون ہیڈ جیسے نام سے پکارتے رہے ہیں، لیکن صرف پچھلی چند دہائیوں میں ہی پوپی ہیڈ بچوں کی پسندیدہ توہین کی صفوں میں شامل ہوا۔
4421411	تخلیقی، آؤٹ سورس حل فراہم کرنے والے اعلی فراہم کنندہ کے طور پر جانا جاتا اور قابل احترام، انفینٹی گروپ اعلی خدمات فراہم کرنے کے نئے اور جدید طریقوں کو تیار کرنے کے لیے وسیع تجربے اور انٹرموڈل آپریشنز اور چیلنجوں کی مکمل تفہیم کا فائدہ اٹھاتا ہے۔
4421412	انفینٹی گروپ کے جائزے۔
4421412	جب میں وہاں تھا تو ایک پرسکون ماحول تھا۔
4421412	لا پورٹے آفس کے لوگوں کے ساتھ کام کرنا بہت اچھا تھا۔
4421412	میں کمپنی کی مختلف شاخوں میں اپنے سپرنٹنڈنٹ اور منیجروں سے محبت کرتا تھا۔
4421412	وہ بہت مددگار، قابل رسائی اور میرے کسی بھی مسئلے یا سوالات سے گزرنے کے لیے تیار تھے۔
4421413	انفینٹی گروپ یو ایس آفس داخلہ آرکیٹیکٹ اور ڈیزائن فرم سی ٹی میں۔ {انفینٹی گروپ یو ایس آفس داخلہ آرکیٹیکٹ اور ڈیزائن فرم} {68 ای ڈڈلی ٹاؤن آر ڈی} {بلوم فیلڈ} {06002} {سی ٹی} {یو ایس اے} {1 860-726-9384}۔
4421413	68 ای ڈڈلی ٹاؤن روڈ 06002 بلوم فیلڈ، سی ٹی۔
4421414	انفینٹی گروپ کے ساتھ آف شور کمپنی تشکیل۔
4421414	آپ کی بین الاقوامی ٹیکس کی منصوبہ بندی کو زیادہ موثر بنانے، اپنے اثاثوں کی حفاظت کو یقینی بنانے اور اپنے کاروبار کی نئی تعریف کرنے کے لیے ایک غیر ملکی کمپنی ایک بہترین ذریعہ ہے۔
4421414	ہم 10 سال سے زیادہ عرصے سے مارکیٹ میں ہیں اور ہم ایک نئی بین الاقوامی کاروباری کمپنی کے اندراج سے متعلق تمام مشکلات پر قابو پانے میں آپ کی مدد کر سکتے ہیں۔
4421415	آپ کے ساتھ کام کرنا ہماری خوشی تھی۔
4421415	جیسا کہ میں نے آپ کو ماضی میں بتایا ہے، میں دوسری کمپنی میں جہاں میں کام کرتا تھا، بڑی اور چھوٹی تزئین و آرائش کرتا تھا اور میرے پاس کبھی بھی ایسے لوگوں کا گروپ نہیں تھا جس کے ساتھ کام کرنا زیادہ شائستہ، ملنسار اور آسان ہو۔
4421415	آپ کی ٹیم ناقابل یقین ہے۔
4421416	سی ای او کی کوئی رائے نہیں۔
4421416	میں نے انفینٹی گروپ کے کل وقتی (ایک سال سے بھی کم) پیشہ ور افراد میں کام کیا۔
4421416	جب میں وہاں تھا تو ایک پرسکون ماحول تھا۔
4421416	لا پورٹے آفس کے لوگوں کے ساتھ کام کرنا بہت اچھا تھا۔
4421416	میں کمپنی کی مختلف شاخوں میں اپنے سپرنٹنڈنٹ اور منیجروں سے محبت کرتا تھا۔
4421417	کلائنٹ کو تیزی سے دستیابی کے استثناء کے ساتھ پہلے سے تیار کردہ آف شور کمپنی کی تشکیل کے لیے طریقہ کار تقریبا یکساں ہے۔
4421417	کمپنی کی خدمات کے بارے میں مزید معلومات کے لیے ہم سے ای میل info@infinity-group.sc یا فون + 248 428 0505 کے ذریعے رابطہ کریں۔
4421418	انفینٹی گروپ آفس داخلہ ڈیزائنرز اور آرکیٹیکٹس۔
4421418	ہم ڈیزائن کے ماہرین، کاروباری شراکت دار اور حل فراہم کرنے والے ہیں۔
4421418	انفینٹی گروپ کے ساتھ شراکت داری کا مطلب ہے کہ آپ نے ایک ایسی ٹیم کے ساتھ کام کرنے کا انتخاب کیا ہے جو آپ کے تعمیر شدہ ماحول میں تبدیلیوں کو نافذ کرنے میں آپ کی مدد کرے گی، ایسی تبدیلیاں جو آپ کے کاروباری اہداف کی عکاسی کرتی ہیں۔
4421419	انفینٹی گروپ۔
4421419	انفینٹی گروپ ایک پرائیویٹ ایکویٹی فنڈ ہے جسے چائنا ڈویلپمنٹ بینک اور کلال انڈسٹریز کی حمایت حاصل ہے۔
4421419	انفینٹی گروپ کے سربراہ امیر گالور ہیں۔
4421419	انفینٹی گروپ پورے چین میں 17 مقامی آر ایم بی فنڈز کے ذریعے آر ایم بی 10 بلین اور 100 پورٹ فولیو کمپنیوں کا انتظام کرتا ہے۔
4421420	گلاسڈور آپ کو دی انفینٹی گروپ میں کام کرنا کیسا لگتا ہے اس پر ایک اندرونی نظر دیتا ہے، جس میں تنخواہ، جائزے، دفتر کی تصاویر اور بہت کچھ شامل ہیں۔
4421420	یہ دی انفینٹی گروپ کمپنی کا خاکہ ہے۔
4421420	تمام مواد دی انفینٹی گروپ میں کام کرنے والے ملازمین کے ذریعے گمنام طور پر پوسٹ کیا جاتا ہے۔
4421421	ٹرولیا پر فروخت کے لیے لبباک گھروں کی اوسط لسٹنگ قیمت 14 اکتوبر کو ختم ہونے والے ہفتے کے لیے 190,953 ڈالر تھی، جو کہ پچھلے ہفتے کے مقابلے میں 0.4 فیصد یا 751 ڈالر کے اضافے اور 23 ستمبر کو ختم ہونے والے ہفتے کے مقابلے میں 0.3 فیصد یا 663 ڈالر کے اضافے کی نمائندگی کرتی ہے۔
4421422	لبباک میں گھر کی اوسط قیمت 154,900 ڈالر ہے، جو کہ لبباک میں فروخت ہونے والی اوسط قیمت (104,814 ڈالر) سے زیادہ ہے۔
4421422	لبباک میں گھر کی اوسط قیمت فی مربع فٹ 75 ڈالر ہے اور پچھلے 6 مہینوں میں لبباک میں فروخت ہونے والے تمام گھروں کا تقریبا 0 فیصد ہے۔
4421423	لبباک کا خلاصہ۔
4421423	ٹرولیا پر فروخت کے لیے لبباک گھروں کی اوسط لسٹنگ قیمت 14 اکتوبر کو ختم ہونے والے ہفتے کے لیے 190,953 ڈالر تھی، جو کہ پچھلے ہفتے کے مقابلے میں 0.4 فیصد یا 751 ڈالر کے اضافے اور 23 ستمبر کو ختم ہونے والے ہفتے کے مقابلے میں 0.3 فیصد یا 663 ڈالر کے اضافے کی نمائندگی کرتی ہے۔
4421424	پیشگی اطلاع: N/A.
4421424	لبباک میں گھر کی اوسط قیمت 154,900 ڈالر ہے، جو کہ لبباک میں فروخت ہونے والی اوسط قیمت (104,814 ڈالر) سے زیادہ ہے۔
4421424	لبباک میں گھر کی اوسط قیمت فی مربع فٹ 75 ڈالر ہے اور پچھلے 6 مہینوں میں لبباک میں فروخت ہونے والے تمام گھروں کا تقریبا 0 فیصد ہے۔
4421425	لبباک، ٹی ایکس میں گھر کی اوسط قیمت 108,400 ڈالر ہے۔
4421425	یہ کاؤنٹی میڈین ہوم ویلیو 109,800 ڈالر سے کم ہے۔
4421425	قومی میڈین ہوم ویلیو 170,100 ڈالر ہے۔
4421425	لبباک، ٹی ایکس میں فروخت ہونے والے گھروں کی اوسط قیمت 108,400 ڈالر ہے۔
4421425	لگ بھگ 50.94% لبباک کے مکانات کی ملکیت ہے، جبکہ 40.02% کرائے پر ہیں، جبکہ 9.04% خالی ہیں۔
4421426	لبباک میں گھر کی اوسط قیمت فی مربع فٹ 75 ڈالر ہے اور پچھلے 6 مہینوں میں لبباک میں فروخت ہونے والے تمام گھروں کا تقریبا 0 فیصد ہے۔
4421426	لبباک کے گھر کی قیمتوں، رئیل اسٹیٹ کی قیمتوں، اور شہر کے بازار کے رجحانات کے لیے، 83,694 جائیداد کے ریکارڈ پر تحقیق کریں یا ہمارے 25 حال ہی میں فروخت شدہ یا 1,886 گھروں کو سیل لسٹنگ کے لیے تلاش کریں۔
4421427	لبباک، ٹی ایکس میں فروخت ہونے والے گھروں کی اوسط قیمت 108,400 ڈالر ہے۔
4421427	لگ بھگ 50.94% لبباک کے مکانات کی ملکیت ہے، جبکہ 40.02% کرائے پر ہیں، جبکہ 9.04% خالی ہیں۔
4421427	لبباک رئیل اسٹیٹ لسٹنگ میں کنڈوز، ٹاؤن ہومز، اور فروخت کے لیے سنگل فیملی ہومز شامل ہیں۔
4421428	گھر کی قیمتیں اور مقبولیت کے رجحانات لبباک، ٹی ایکس میں پڑوس یا زپ کے لحاظ سے دیکھیں-اوسط لسٹنگ قیمت، اوسط سیلز قیمت، اوسط سیلز قیمت، اوسط قیمت/مربع فٹ اور تلاش کی مقبولیت کے لحاظ سے ترتیب دیں۔
4421428	نقشے پر اصل قیمتوں یا سال بہ سال (Y-O-Y) فیصد تبدیلیوں کو دیکھنے کے درمیان انتخاب کریں۔
4421429	قومی میڈین ہوم ویلیو 170,100 ڈالر ہے۔
4421429	لبباک، ٹی ایکس میں فروخت ہونے والے گھروں کی اوسط قیمت 108,400 ڈالر ہے۔
4421429	لگ بھگ 50.94% لبباک کے مکانات کی ملکیت ہے، جبکہ 40.02% کرائے پر ہیں، جبکہ 9.04% خالی ہیں۔
4421429	لبباک رئیل اسٹیٹ لسٹنگ میں کنڈوز، ٹاؤن ہومز، اور فروخت کے لیے سنگل فیملی ہومز شامل ہیں۔
4421430	ایجنٹس نے پچھلے مہینے 252 سیلز کو 127,898 ڈالر کی اوسط سیلز قیمت کے ساتھ بند کیا، اس کے مقابلے میں مارچ میں 210 کلوزنگ کے ساتھ 143,800 ڈالر کی اوسط سیل قیمت تھی۔
4421430	ٹیکساس اے اینڈ ایم یونیورسٹی کے رئیل اسٹیٹ ڈیٹا سینٹر کے مطابق، اپریل 2010 میں، ایجنٹوں نے 321 سیلز بند کیں، جن کی اوسط قیمت $137,081 تھی۔
4421431	ٹھیک ہے لوگ، میں ٹربو دنیا میں نیا ہوں اور ان کے بارے میں زیادہ نہیں جانتا ہوں۔
4421431	میرے پاس ایک اسٹاک 2000 جی ایم سی سیرا ہے جس میں 5.3...it اچھا چلتا ہے لیکن یہ بہت سست ہے۔
4421431	اس لیے میں اس پر ٹربو لگانا چاہتا ہوں۔
4421431	میرے والد ایک میکینک ہیں اور ہر چیز میں میری مدد کریں گے.... میرے پاس پہلے سے ہی مختلف سائز کے 4 یا 5 ٹربو ہیں جو around.osts: 2,377 بچھا رہے ہیں۔
4421431	پی ایس آئی کو فروغ دینا غیر متعلقہ ہے، سوال یہ ہے کہ اس کے پاس کتنی طاقت ہوگی۔
4421431	فروغ صرف مزاحمت کا ایک پیمانہ ہے اور یہ ٹربو کے لحاظ سے مختلف ہو سکتا ہے۔
4421431	چھوٹا ٹربو = وہی طاقت جس میں بڑے ٹربو ڈبلیو/کم بوسٹ سے زیادہ بوسٹ ہوتا ہے۔
4421432	ڈبلیو/اسٹاک ٹربو کو کتنا فروغ دیں۔
4421432	اسٹاک ٹربو کتنا فروغ دے گا۔
4421432	میرے پاس ایک #6 فیول پلیٹ ہے باقی ہے stock.i تازہ ہوا کی مقدار حاصل کرے گا اور بلی اور مفلر سے چھٹکارا حاصل کرے گا (اگر یہ فرق کرتا ہے)۔ ڈبلیو/اسٹاک ٹربو کو کتنا فروغ دے گا۔
4421432	اسٹاک ٹربو کتنا فروغ دے گا۔
4421432	میرے پاس ایک #6 فیول پلیٹ ہے باقی اسٹاک ہے۔
4421433	12 والو سیکنڈ جنرل ڈوج کمنز 94-98 P7100 انجیکشن پمپس کے ساتھ 12 والو 5.9 لیٹر ڈوج کمنز ڈیزل پر بحث۔
4421433	اسٹاک ٹربو کتنا فروغ دے گا۔
4421433	میرے پاس ایک #6 فیول پلیٹ ہے باقی اسٹاک ہے۔
4421433	میں تازہ ہوا حاصل کروں گا اور آگے بلی اور مفلر سے چھٹکارا حاصل کروں گا (اگر اس سے فرق پڑتا ہے)۔ ڈبلیو/اسٹاک ٹربو کو کتنا فروغ دیں۔
4421433	اسٹاک ٹربو کتنا فروغ دے گا۔
4421433	میرے پاس ایک #6 فیول پلیٹ ہے باقی اسٹاک ہے۔
4421434	اسٹاک ایل ایس 1 موٹرز بغیر کسی دھماکہ کے 91 آکٹین پر صرف 6-8 پی ایس آئی کو ہینڈل کریں گے اور انجن کے وقت میں رکاوٹ پیدا کرنے والے ناک سینسر۔ اگر آپ واٹر/میتھ انجیکشن کٹ شامل کرتے ہیں تو کیمیائی انٹرکولنگ کی وجہ سے آپ اسے 12 پی ایس آئی تک چلا سکتے ہیں۔ میں نے 97 کے بعد سے کافی ایل ایس/ورٹیک موٹرز بنائے ہیں۔ اس کا جواب ہے: آئی وی ای کے پاس 13 ایل بی ایس اسٹاک ایل ایس 1 کیمارو رننگ کے لیے 13 ایل بی ایس بوسٹ تھا۔ میں اسے 11 ایل بی ایس پر چھوڑتا ہوں جس میں کوئی مسئلہ نہیں ہے کہ موٹر کچھ نہیں بنا رہا ہے، صرف ایک پاورڈائن سپرچارجر!!!
4421434	آپ کی گاڑی 10-12 پونڈ محفوظ طریقے سے چلانے کے قابل ہونی چاہیے!!!!!
4421434	93 اکتوبر پر ایک مسئلہ کے ساتھ۔
4421435	بدسلوکی کی اطلاع دیں۔
4421435	اسٹاک ایل ایس 1 موٹرز بغیر کسی دھماکہ کے 91 آکٹین پر صرف 6-8 پی ایس آئی کو ہینڈل کریں گے اور انجن کے وقت میں رکاوٹ پیدا کرنے والے ناک سینسر۔ اگر آپ واٹر/میتھ انجیکشن کٹ شامل کرتے ہیں تو کیمیائی انٹرکولنگ کی وجہ سے آپ اسے 12 پی ایس آئی تک چلا سکتے ہیں۔ میں نے 97 کے بعد سے کافی ایل ایس/ورٹیک موٹرز بنائے ہیں۔ اس کا جواب ہے: آئی وی ای کے پاس 13 ایل بی ایس اسٹاک ایل ایس 1 کیمارو رننگ کے لیے 13 ایل بی ایس بوسٹ تھا۔ میں اسے 11 ایل بی ایس پر چھوڑتا ہوں جس میں کوئی مسئلہ نہیں ہے کہ موٹر کچھ نہیں بنا رہا ہے، صرف ایک پاورڈائن سپرچارجر!!!
4421435	آپ کی گاڑی 10-12 پونڈ محفوظ طریقے سے چلانے کے قابل ہونی چاہیے!!!!!
4421435	93 اکتوبر پر ایک مسئلہ کے ساتھ۔
4421436	کیا کسی کو معلوم ہے کہ اسٹاک انٹرنلز کے ساتھ 3.0 میکسیما کتنا ایچ پی سنبھال سکتا ہے؟
4421436	اگر آپ کے پاس ٹربو میکسیما ہے کہ آپ اسٹاک انٹرنلز کے ساتھ کتنا پی ایس آئی چلا رہے ہیں اور آپ کتنی طاقت بنا رہے ہیں؟ اپنے انجن اور ٹیون پر خرچ کرتے ہوئے، آپ اسٹاک انٹرنلز پر تقریبا 450-500 ایچ پی بنا سکتے ہیں۔ یہ اعلی اختتام ہے۔
4421436	امکان سے زیادہ، آپ 350-400 رینج میں ختم ہو جائیں گے۔
4421436	یہ سب عام ہیں، آپ جس چیز کی توقع کر سکتے ہیں وہ مختلف ہوگی کیونکہ ہمیں اندازہ نہیں ہے کہ آپ کی موٹر کو کیسے برقرار رکھا گیا تھا اور اب یہ کیسے چلتا ہے۔
4421437	میرے پاس 1989 کا 4 ایکس 4 جی ایم سی جمی 6.2 ایل ہے، جو اے ٹی ایس ٹربو کٹ سے لیس ہے، ٹربو لانگ اسٹائل انجیکٹر، ہیوی ڈیوٹی انجیکشن پمپ، 700 آر 4 دوبارہ تعمیر شدہ ٹرانس، 3:42 گیئرز، 31 انچ بی ایف جی کیچڑ tires.Truck کرتا ہے 75-80 میل فی گھنٹہ، فری وے پر، پہاڑ پر، پہاڑی پر نہیں، اتارا ہوا، تیسرا گیئر، ڈبلیو او ٹی، 10-12 پی ایس آئی بوسٹ۔
4421437	1989 کا 4 ایکس 4 جی ایم سی جمی 6.2 ایل، اے ٹی ایس ٹربو کٹ سے لیس، ٹربو لانگ اسٹائل انجیکٹر، ہیوی ڈیوٹی انجیکشن پمپ، 700 آر 4 دوبارہ تعمیر شدہ ٹرانس، 3:42 گیئرز، 31 انچ بی ایف جی مٹی کے ٹائر ہیں۔
4421438	ٹارک نمبر وہ ہے جسے آپ یہ فیصلہ کرتے وقت دیکھنا چاہتے ہیں کہ اسٹاک انٹرنلز کیا سنبھال سکتے ہیں۔
4421438	کہیں بھی 420 + ڈبلیو ٹی کیو آپ کو پریشان ہونا چاہیے۔
4421438	یہ تب ہوتا ہے جب سلاخیں جھکنا شروع ہو جائیں گی۔
4421438	میں نے ایک آدمی کے بارے میں سنا ہے جو ورٹیک کٹ کے ساتھ اسٹاک بلاک پر 500 ڈبلیو ایچ پی اور 400 ڈبلیو ٹی کیو بناتا ہے۔
4421438	آئی ڈی کے یہ کتنی دیر تک جاری رہا though.y 03 زیڈ میں تمام اسٹاک انٹرنلز کے ساتھ ایک گریڈی جڑواں ٹربو کٹ ہے اور اسے 418 ڈبلیو ایچ پی پر ڈائنوڈ کیا گیا تھا۔
4421438	میں بوسٹ کو تھوڑا بڑھانا چاہتا ہوں لیکن اس سے زیادہ نہیں کرنا چاہتا۔
4421438	کیا آپ لوگوں کو مشورہ دیں گے کہ اسے ویسے ہی چھوڑ دیں جیسے یہ ہے یا کیا میں اسے کچھ کرانک کر سکتا ہوں؟
4421438	اور اگر ایسا ہے تو، میں کس چیز کو سب سے زیادہ محفوظ طریقے سے نیچے رکھ سکتا ہوں؟
4421439	اگر آپ سپر چارجر لگاتے ہیں تو اسٹاک 08 5.7 ایل انجن کتنا ایچ پی سنبھال سکتا ہے؟
4421439	میرا دوست ہر وقت ہارس ٹریلرز چلاتا ہے اور یہ یہاں بہت پہاڑی ہے Northeast.ow زیادہ HP میں کیا اسٹاک 08 5.7L انجن سنبھال سکتا ہے اگر آپ سپر چارجر لگائیں؟
4421439	میرا دوست ہر وقت ہارس ٹریلرز چلاتا ہے اور یہ یہاں شمال مشرق میں کافی پہاڑی ہے۔
4421440	میرے 03 زیڈ میں تمام اسٹاک انٹرنلز کے ساتھ ایک گریڈی جڑواں ٹربو کٹ ہے اور اسے 418 ڈبلیو ایچ پی پر ڈائنوڈ کیا گیا تھا۔
4421440	میں بوسٹ کو تھوڑا بڑھانا چاہتا ہوں لیکن زیادہ نہیں کرنا چاہتا it.Would آپ لوگ اسے ویسے ہی چھوڑنے کا مشورہ دیتے ہیں جیسے یہ ہے یا کیا میں اسے کچھ کرانک کر سکتا ہوں؟
4421440	اور اگر ایسا ہے تو، میں سب سے زیادہ کس چیز کو محفوظ طریقے سے نیچے رکھ سکتا ہوں؟ y 03 Z کے پاس تمام اسٹاک انٹرنلز کے ساتھ ایک گریڈی ٹوئن ٹربو کٹ ہے اور اسے 418 ڈبلیو ایچ پی پر ڈائنوڈ کیا گیا تھا۔
4421440	میں بوسٹ کو تھوڑا بڑھانا چاہتا ہوں لیکن اس سے زیادہ نہیں کرنا چاہتا۔
4421440	کیا آپ لوگوں کو مشورہ دیں گے کہ اسے ویسے ہی چھوڑ دیں جیسے یہ ہے یا کیا میں اسے کچھ کرانک کر سکتا ہوں؟
4421440	اور اگر ایسا ہے تو، میں کس چیز کو سب سے زیادہ محفوظ طریقے سے نیچے رکھ سکتا ہوں؟
4421441	بیک سپلیکس چوکسلم اس بلند چوکسلم میں پہلوان مخالف کے پیچھے کھڑا ہوتا ہے، اپنا سر مخالف کے بازوؤں میں سے ایک کے نیچے رکھتا ہے، اور انہیں اپنے کندھے پر اٹھا لیتا ہے۔
4421442	لفٹ اپ کے بعد ریسلنگ میٹ میں سلیم داخل ہوتا ہے اور کچھ سیلنگ اس اقدام کو مکمل کرتی ہے۔
4421442	سب سے پہلے استعمال کیا گیا بہت ساری خرافات ہیں جو اس کے گرد گھومتی ہیں کہ کس نے پہلے چوکسلم کا استعمال کیا لیکن دوڑنے کی سب سے نمایاں کہانی تقریبا 911 ہے۔
4421442	911 ای سی ڈبلیو کے دنوں میں پال ہیمن کا آدمی تھا جسے اکثر چوکسلم ایجاد کرنے والے شخص کے طور پر جانا جاتا ہے۔
4421443	ابراہم لنکن یقین کریں یا نہ کریں!
4421443	ابراہم لنکن نے چوکسلم کی پہلی معروف مثال پیش کی۔
4421443	مشہور لنکن سوانح نگار کارل سینڈبرگ نے اپنی 1940 کی کتاب دی ریری ایئرز میں لکھا ہے کہ انہوں نے کشتی لڑی، اور یہ کہ ایک مقامی چیمپئن نے اپنے پاؤں پر چھلانگ لگا کر دھوکہ دیا۔
4421444	ایسکر کی درجہ بندی۔
4421444	بدسلوکی کی اطلاع دیں۔
4421444	ناقابل یقین حد تک، ابراہم لنکن نے چوکسلم ایجاد کیا۔
4421444	ابراہم لنکن ایک پہلوان تھا اور اپنے میچوں کے دوران یا اختتام پر اس کے مخالف نے اس کے پاؤں پر قدم رکھا تاکہ اس نے اپنے مخالف کو گلے سے پکڑ کر اسے ہوا میں اٹھا لیا، اسے راگ کی طرح ہلا دیا، اور اسے زمین پر پھینک دیا۔
4421444	The · 1 سال پہلے
4421445	چوکسلم ایک خاص حملہ ہے۔
