4420912	یہ ایک اچھا سوال ہے۔
4420912	میں نے اپنا پرائم اکاؤنٹ اپنے گھر پر تین ڈیوائسز پر سیٹ اپ کیا ہے، ایک ٹی ایکس کے ایک شہر میں اور پھر چار کنڈلز پر، یہ سب بغیر کسی پریشانی کے اسٹریم ہوتے ہیں۔
4420912	ایک ہی وقت میں صرف دو ہی جا رہے ہیں تو مجھے یقین نہیں ہے کہ ایک ہی وقت میں مزید چل سکتے ہیں یا نہیں۔
4420913	مفت شپنگ، مفت 2 دن کی ترسیل، اور ایمیزون انسٹنٹ ویڈیو: تین سب سے بڑی وجوہات جن کی وجہ سے 20 ملین سے زیادہ صارفین کے پاس ایمیزون پرائم کی مسلسل سبسکرپشن ہے۔
4420914	ڈیوائس: کوبو ایچ ڈی گلو، 2 جلانے والے فائر ایچ ڈی، گٹھ جوڑ 7، 3 فیبلٹس۔
4420914	مجھے بتایا گیا تھا کہ ایک وقت میں دو ایک ہی وقت میں پرائم استعمال کر سکتے ہیں لیکن ایک وقت میں صرف ایک ہی ویڈیو دیکھ سکتا ہے۔
4420914	لہذا دوسرے آلے کو کچھ اور دیکھنے کی ضرورت ہوگی۔
4420915	ایمیزون اسٹوڈنٹ کی طرح، ایمیزون موم کا مفت ٹرائل ہے (تاہم، یہ صرف تین ماہ مفت دیتا ہے) اس کے بعد ہر سال $79 کی فیس ہوتی ہے۔
4420915	یہ پروگرام نئے والدین کے لیے مصنوعات پر خصوصی چھوٹ، ایمیزون کی مفت دو روزہ پرائم شپنگ اور ویڈیو اور ای بک تک رسائی پیش کرتا ہے۔
4420916	اگر میں ایمیزون پرائم (فوری ویڈیوز کے لیے) سائن اپ کرتا ہوں، تو میں ایک ہی وقت میں کتنے آلات پر ویڈیو اسٹریم کر سکتا ہوں؟
4420916	کتنے آئی پی ایڈریس کی اجازت ہے؟
4420916	میں اپنا اکاؤنٹ دوسروں کے ساتھ شیئر نہیں کر رہا ہوں، لیکن جب ایک کام پر جاتا ہے تو دوسرا اسکول جاتا ہے، دوسرا گھر میں رہتا ہے...، کیا ہم سب ایک ہی وقت میں انسٹنٹ ویڈیو استعمال کر سکتے ہیں؟
4420917	خون کا حجم پلازما کا حجم سرخ خلیے کے حجم میں شامل ہوتا ہے ؛ خون کا حجم بھی دیکھیں۔
4420917	کلوزنگ والیوم (سی وی) پھیپھڑوں میں گیس کا حجم بقایا حجم سے زیادہ ہوتا ہے جب منحصر حصوں میں چھوٹے ہوا کے راستے زیادہ سے زیادہ سانس کے دوران بند ہوتے ہیں۔ کلوزنگ والیوم بھی دیکھیں۔
4420918	پھیپھڑوں کی کل صلاحیت (ٹی ایل سی): بقیہ حجم (ہوا جس کی آپ میعاد ختم نہیں کر سکتے) + اہم صلاحیت (استعمال کے لیے دستیاب کل حجم) = پھیپھڑوں کی کل صلاحیت۔
4420918	دوسرے لفظوں میں، ٹی ایل سی پھیپھڑوں کا کل حجم ہے!
4420918	کم سے کم حجم (ایم وی): اگر پھیپھڑوں کا حجم اس قدر سے نیچے گر جائے تو پھیپھڑے گر جائیں گے۔
4420919	یہ عارضہ 50 سال کی عمر کے آس پاس شروع ہوتا ہے اور علامات 10-15 سالوں کے بعد ظاہر ہو سکتی ہیں۔
4420919	بی پی ایچ ایک ترقی پسند عارضہ ہے اور مثانے کی گردن کو تنگ کر دیتا ہے جس کی وجہ سے پیشاب برقرار رہتا ہے۔
4420919	70 سال کی عمر تک، تقریبا 10 فیصد مردوں میں کچھ حد تک بی پی ایچ ہوتا ہے اور 33 فیصد کو زندگی کی آٹھویں دہائی تک یہ ہوتا ہے۔
4420920	معدومیت کے بعد بقیہ پیشاب 50 ملی لیٹر سے زیادہ ہونا پیشاب کی ایک قابل ذکر مقدار ہے اور پیشاب کی نالی کے بار بار ہونے والے انفیکشن کے امکان کو بڑھاتا ہے۔
4420920	60 سال سے زیادہ عمر کے بالغوں میں، ڈٹرسر پٹھوں کے سکڑنے میں کمی کی وجہ سے ہر وایڈنگ کے بعد بقایا پیشاب کا 50-100 ملی لیٹر رہ سکتا ہے۔
4420920	دائمی برقرار رکھنے میں، مثانے کا الٹراساؤنڈ مثانے کی صلاحیت میں بڑے پیمانے پر اضافہ ظاہر کر سکتا ہے (عام صلاحیت 400-600 ml ہے)۔
4420920	سیرم پروسٹیٹ مخصوص اینٹیجن (پی ایس اے) کا تعین کرنے سے پروسٹیٹ کینسر کی تشخیص یا اسے مسترد کرنے میں مدد مل سکتی ہے، حالانکہ یہ بی پی ایچ اور پروسٹیٹائٹس میں بھی اٹھایا جاتا ہے۔
4420921	(عام افراد میں، کاربن ڈائی آکسائیڈ ریسپریٹری ڈرائیو کا بنیادی تعین کنندہ ہے۔
4420921	) پھیپھڑوں کی مقدار میں مخصوص تبدیلیاں حمل کے دوران بھی ہوتی ہیں۔
4420921	بچہ دانی کے ذریعے ڈایفگرام کے دباؤ کی وجہ سے فعال بقایا صلاحیت میں کمی دیکھی جاتی ہے، جو عام طور پر 1.7 سے 1.35 لیٹر تک گر جاتی ہے۔
4420921	کمپریشن بھی پھیپھڑوں کی کل صلاحیت (ٹی ایل سی) میں 5 فیصد کی کمی کا سبب بنتا ہے اور ایکسپائریٹری ریزرو حجم میں کمی کا سبب بنتا ہے۔
4420922	چونکہ بقیہ ہوا کو باہر نہیں نکالا جا سکتا، اس لیے گیس ڈائلیوشن تکنیک اور متاثر ہوا میں ہیلیم کے استعمال کے ذریعے حجم کا اندازہ لگایا جا سکتا ہے (ہم ہیلیم کو میٹابولائز نہیں کرتے)۔
4420922	فنکشنل بقایا صلاحیت: یہ معمول، آرام کی میعاد ختم ہونے کے اختتام پر پھیپھڑوں میں باقی ہوا کا کل حجم ہے۔
4420923	پیشاب کو برقرار رکھنے کی خصوصیت پیشاب کے خراب بہاؤ کے ساتھ وقفے وقفے سے بہاؤ، تناؤ، نامکمل آواز کا احساس، اور ہچکچاہٹ (پیشاب کرنے کی کوشش اور اصل میں بہاؤ شروع ہونے کے درمیان تاخیر) ہے۔
4420923	جیسا کہ مثانہ بھرا رہتا ہے، یہ بے قابو پن، نوکٹوریا (رات کو پیشاب کرنے کی ضرورت)، اور زیادہ تعدد کا باعث بن سکتا ہے۔
4420924	ڈبلیو این بی اے کے 2011 نمبر کے مطابق اس میں سچائی ہے۔
4420924	1 مجموعی طور پر ڈرافٹ پک مایا مور، جو فی الحال مینیسوٹا لنکس کے لیے کھیلتی ہیں۔
4420925	10 ویں سال کی تنخواہ کا پیمانہ۔
4420925	2006 میں ڈبلیو این بی اے کی 10 سالہ سالگرہ کے سیزن کے دوران، لیگ نے اوسطا سالانہ 47,000 ڈالر اور زیادہ سے زیادہ 91,000 ڈالر تنخواہ ادا کی۔
4420925	نیویارک ٹائمز نے مئی 2006 میں اطلاع دی کہ پچاس فیصد کھلاڑیوں نے 42,000 ڈالر یا اس سے کم کمائے۔
4420926	حاضری بھی ڈبلیو این بی اے کے ساتھ ایک مسئلہ ہے۔
4420926	اسپورٹس بزنس ڈیلی کے مطابق 2014 میں ٹیموں کا اوسط فی گیم صرف 7,578 شائقین تھا۔
4420926	سلور لائننگ یہ ہے کہ یہ تعداد پچھلے سال سے قدرے زیادہ ہے، لیکن یہ 1990 کی دہائی سے اب بھی کم ہے جب ڈبلیو این بی اے کی حاضری کی شرح اپنی بلند ترین سطح پر تھی۔
4420926	1999 میں، کھیلوں میں اوسطا 10,864 افراد کی شرکت کے ساتھ حاضری عروج پر پہنچ گئی۔
4420927	میں ایسوسی ایٹڈ پریس اور فاکس اسپورٹس ڈیٹرائٹ کے لیے باقاعدہ بنیاد پر کام کرتا ہوں...
4420927	$75,000 اور $80,000 کے درمیان۔
4420927	زیادہ سے زیادہ تقریبا 105,000 ڈالر ہے۔
4420927	کوبی برائنٹ پورے ڈبلیو این بی اے سے تقریبا ڈھائی گنا زیادہ پیسہ کماتے ہیں۔
4420927	ویوز۔ ویو اپ ووٹس۔
4420928	اس پر غور کریں، 2010 میں تجربہ کار کھلاڑیوں کے لیے ڈبلیو این بی اے کی زیادہ سے زیادہ تنخواہ 101,000 ڈالر ہے۔
4420928	اپنے مرد ہم منصبوں کے بڑے تنخواہوں اور توثیق کے سودوں سے کافی شرمندہ ہیں۔
4420928	درحقیقت، این بی اے کا اوسط کھلاڑی 5 ملین ڈالر سے زیادہ کماتا ہے۔
4420928	یہاں سب سے زیادہ پہچانے جانے والے ڈبلیو این بی اے کھلاڑیوں کے کچھ اعلی تنخواہوں پر ایک نظر ڈالیں۔
4420929	ڈبلیو این بی اے، جو 13 سال کا ہے، نے گذشتہ برسوں کے دوران مسلسل مقبولیت حاصل کی ہے، لیکن اگر آپ کو لگتا ہے کہ خواتین مردوں کے قریب تر ہو رہی ہیں، تو دوبارہ سوچیں۔
4420929	عدم مساوات تشویشناک ہے، لیکن چیزیں بدل رہی ہیں۔
4420929	تصاویر میں: سب سے اوپر 5 سب سے زیادہ بال بڑھانے کے معاہدے۔
4420929	روکیوں کو کم از کم $35,190 ادا کیے جاتے ہیں۔
4420930	اسے بیبی بیک پسلیاں، کمر کی پسلیاں، کمر کی پسلیاں، کمر کی پسلیاں یا کینیڈین بیک پسلیاں بھی کہا جاتا ہے۔
4420930	پسلی کا یہ کٹ سور کے گوشت کی کمر کے بلیڈ اور درمیانی حصے سے آتا ہے۔
4420930	عرفی نام، بیبی بیک اس لیے لیا گیا ہے کیونکہ پسلی پسلیوں کے اگلے حصے، اسپیئر پسلیوں سے چھوٹی ہوتی ہے۔
4420930	کمر کی پسلی دیگر کٹوتیوں کے مقابلے میں گوشت دار ہوتی ہے، جس میں ہڈیوں کے درمیان گوشت، یا "انگلی کا گوشت" کے ساتھ ساتھ ہڈیوں کے اوپر بھی ہوتا ہے۔
4420931	سور کے گوشت کے ابتدائی کٹوے۔
4420931	سور کے گوشت کے چار مختلف کٹوے تھوک کی سطح پر فروخت کیے جاتے ہیں۔
4420931	کٹوتیوں کے اس پہلے سلسلے سے، جسے تجارت میں ابتدائی کٹوتیوں کے نام سے جانا جاتا ہے، ایک قصاب (عام طور پر مڈویسٹ میں میٹ پیکنگ پلانٹ میں لیکن بعض اوقات آپ کے بازار میں سائٹ پر) خوردہ کٹوتیاں کرے گا جو آپ بازار سے گھر لاتے ہیں۔
4420932	گوشت کا یہ کٹ دراصل کندھے کے قریب سور کے گوشت کی کمر کے سرلوئن یا پسلی کے سرے سے کاٹا جاتا ہے۔
4420932	ملکی طرز کی پسلیاں ایک گوشت دار کٹ ہوتی ہیں جو پسلی سے زیادہ سور کے گوشت کی طرح ہوتی ہیں۔
4420932	انہیں یا تو "سلیب" کے طور پر یا انفرادی طور پر فروخت کیا جاتا ہے۔
4420932	ایسا لگتا ہے کہ انفرادی ٹکڑے زیادہ عام ہیں۔
4420933	سور کا گوشت پسلی کا روسٹ سور کا گوشت ہے جو کھڑے گائے کے گوشت کے پسلی کے روسٹ یا بھیڑ کے ریک کے برابر ہے۔
4420933	آپ نے سور کے گوشت کے اس کٹے ہوئے حصے کو سور کے گوشت کے تاج کے روسٹ کے طور پر دیکھا ہوگا، جو سور کے گوشت کی پسلی کا روسٹ ہے جسے دائرے میں تبدیل کر کے باندھ دیا جاتا ہے۔
4420933	یہ کٹ ایک شو روکنے والا، خوبصورت ڈنر بناتا ہے۔
4420934	لہذا کتابوں کے تراشے ہوئے سائز کو تبدیل کرنا اس بات کی علامت ہے کہ یہ زیادہ بڑی ہو چکی ہے اور کتابوں کو دوسرے ابتدائی قارئین کے ساتھ فٹ ہونے دیتی ہے۔ "
4420934	یہ اصلاحاتی پروگرام اگلے جنوری میں جاری رہے گا، جب ہولٹ پانڈا بیئر اور بیبی بیئر کے مائی فرسٹ ریڈر ایڈیشن جاری کرے گا۔
4420934	مائی فرسٹ ریڈرز میں تعارف اور اضافی مواد شامل ہے جو لورا روب نے تخلیق کیا ہے، جو ایک ماہر تعلیم اور پڑھنے کی ماہر ہے جسے گوڈون نوٹ کرتا ہے کہ وہ کئی سالوں سے مارٹن کی ساتھی تھی۔
4420935	1 لکھنا: بڑے بچے اپنے رنگین صفحات کے نچلے حصے میں رنگ اور جانور لکھ سکتے ہیں (مثلا: پولر بیئر)۔
4420935	2 یا، ان چھوٹے بچوں کے لیے جو پڑھنا شروع کر رہے ہیں لیکن ابھی لکھ نہیں سکتے، ایک بالغ سے ہر جانور کو کاغذ کی ایک پرچی پر لکھنے کو کہیں۔
4420936	تمام دستیاب فارمیٹس اور ایڈیشن دیکھیں۔
4420936	ایک بڑا خوش مینڈک، ایک موٹی جامنی بلی، ایک خوبصورت نیلا گھوڑا، اور ایک نرم پیلے رنگ کی ڈک-یہ سب اس دلکش کتاب کے صفحات پر پریڈ کرتے ہیں۔
4420936	بچے فوری طور پر ایرک کارل کے فلیٹ، دلیری سے رنگین کولاجز کا جواب دیں گے۔
4420937	1 رنگ کی پہچان: چھوٹے بچوں کے لیے، آپ میموری کے بجائے رنگ کی شناخت پر توجہ مرکوز کرتے ہوئے ان کی تھوڑی زیادہ رہنمائی کرنا چاہیں گے۔
4420937	2 انہیں مختلف قسم کے کریون دیں اور انہیں ریچھ کو بھورا، پرندے کو سرخ وغیرہ رنگنے کی ہدایت دیں۔
4420937	3 جانوروں کی آوازیں: جیسے ہی آپ تصاویر کو رنگتے ہیں، ہر جانور کے بارے میں بات کریں۔
4420938	ہنری ہولٹ بکس فار ینگ ریڈرز کی وی-پی اور ناشر لورا گوڈون کا کہنا ہے کہ یہ بات بالکل سمجھ میں آتی ہے کہ مارٹن، ایک سابق استاد جس کا 2004 میں انتقال ہوا، نے ابتدائی طور پر براؤن بیئر کو ایک ابتدائی قاری کے طور پر لکھا تھا۔
4420939	1 آپ جانوروں کی پریڈ کر سکتے ہیں... 2 بچوں کو کہانی میں مذکور ترتیب کے مطابق ترتیب دیں اور انہیں اپنی کٹھ پتلی لہراتے ہوئے کمرے کے گرد چکر لگانے دیں۔
4420939	3 جانوروں کی آوازیں: جیسے ہی آپ تصاویر کو رنگتے ہیں، ہر جانور کے بارے میں بات کریں۔
4420940	اس ایڈیشن کی فروخت میں اضافہ ہوا، اور اس کے بعد سیریز کی تصویری کتابیں-قطبی ریچھ، قطبی ریچھ، آپ کیا سنتے ہیں؟
4420940	، پانڈا ریچھ، پانڈا ریچھ آپ کیا دیکھتے ہیں؟
4420940	، اور بیبی بیئر، بیبی بیئر، آپ کیا دیکھتے ہیں؟
4420940	۔۔۔۔۔۔۔۔۔۔۔۔۔۔۔۔۔۔۔۔۔۔۔۔۔۔۔۔۔۔۔۔۔۔۔۔۔۔۔۔۔۔۔۔۔۔۔۔۔۔۔۔۔۔۔۔۔۔۔۔۔۔۔۔۔۔۔۔۔۔۔۔۔۔۔۔۔۔۔۔۔۔۔۔۔۔۔۔۔۔۔۔۔۔۔۔۔۔۔۔۔۔۔۔۔۔۔۔۔۔۔۔۔۔۔۔۔۔۔۔۔۔۔۔۔۔۔۔۔۔۔۔۔۔۔۔۔۔۔۔۔۔۔۔۔۔۔۔۔۔۔۔۔۔۔۔۔۔۔۔۔۔۔۔۔۔۔۔۔۔۔۔۔۔۔۔۔۔۔۔۔۔۔۔۔۔۔۔۔۔۔۔۔۔۔۔۔۔۔۔
4420941	وہ کہتی ہیں، "بل ایرک کے بارے میں کچھ نہیں جانتا تھا، لیکن وہ جانتا تھا کہ وہ فن اس سے کیا کہتا ہے۔"
4420941	اس نے اپنی جبلت پر بھروسہ کیا اور اپنے آپ سے کہا، 'یہ میرا لڑکا ہے۔'
