4421895	3 دیگر وجوہات میں انفیکشن، آٹو امیون بیماری، اور آپٹک اعصاب کو چوٹ شامل ہیں۔
4421896	آپٹک نیورائٹس کی صحیح وجہ معلوم نہیں ہے۔
4421896	تاہم، خیال کیا جاتا ہے کہ آپٹک نیورائٹس اس وقت پیدا ہوتا ہے جب مدافعتی نظام غلطی سے آپ کے آپٹک اعصاب (مائیلن) کو ڈھانپنے والے مادے کو نشانہ بناتا ہے، جس کے نتیجے میں سوزش ہوتی ہے اور مائیلن کو نقصان پہنچتا ہے۔
4421897	1 آپٹک نیورائٹس اکثر ایک سے زیادہ سکلیروسیس سے وابستہ ہوتا ہے۔
4421897	2 دیگر وجوہات میں انفیکشن، آٹو امیون بیماری، اور آپٹک اعصاب کو چوٹ شامل ہیں۔
4421897	3 آپٹک نیورائٹس کی علامات میں زیادہ تر معاملات میں بینائی کا نقصان، رنگین بینائی میں کمی، اور ہفتوں سے ایک ماہ تک صحت یابی کے ساتھ آنکھ کی حرکت میں درد شامل ہیں۔
4421898	1 دیگر وجوہات میں انفیکشن، آٹو امیون بیماری، اور آپٹک اعصاب کو چوٹ شامل ہیں۔
4421898	2 آپٹک نیورائٹس کی علامات میں بینائی کا نقصان، رنگین بینائی میں کمی، اور زیادہ تر معاملات میں ہفتوں سے ایک ماہ تک صحت یابی کے ساتھ آنکھ کی حرکت میں درد شامل ہیں۔
4421899	وجوہات۔
4421899	آپٹک نیورائٹس کی صحیح وجہ معلوم نہیں ہے۔
4421899	تاہم، خیال کیا جاتا ہے کہ آپٹک نیورائٹس اس وقت پیدا ہوتا ہے جب مدافعتی نظام غلطی سے آپ کے آپٹک اعصاب (مائیلن) کو ڈھانپنے والے مادے کو نشانہ بناتا ہے، جس کے نتیجے میں سوزش ہوتی ہے اور مائیلن کو نقصان پہنچتا ہے۔
4421900	1 آپٹک نیورائٹس کی علامات میں بینائی کا نقصان، رنگین بینائی میں کمی، اور زیادہ تر معاملات میں ہفتوں سے ایک ماہ تک صحت یابی کے ساتھ آنکھ کی حرکت میں درد شامل ہیں۔
4421900	2 تشخیص مریض کی تاریخ اور ماہر امراض چشم کے ذریعے معائنے کی بنیاد پر کی جاتی ہے۔
4421901	ممتاز ایڈج (= معروف) [شخص] اہم (ای) بہت ممتاز یا کامیاب والدین کے بچے۔ ایک ممتاز سیاست دان۔ ایک اشرافیہ انگریزی خاندان کا ایک ممتاز رکن جو ایس ٹی ایچ جوئر ان رول رول ڈی پریمیئر پلان میں نمایاں تھا۔
4421901	مذاکرات
4421902	آپٹک نیورائٹس کی نشوونما سے منسلک دیگر عوامل میں شامل ہیں: 1 انفیکشن۔
4421902	2 بیکٹیریل انفیکشن، بشمول لائم بیماری، بلی سکریچ بخار اور سفلس، یا وائرس جیسے خسرہ، ممپس اور ہرپس آپٹک نیورائٹس کا سبب بن سکتے ہیں۔
4421903	'ممتاز' فرانسیسی-انگریزی لغت کے ترجمے میں بھی پایا جاتا ہے۔
4421903	نمایاں۔
4421903	ممتاز۔
4421903	نمایاں۔
4421903	ممتاز۔
4421903	اجو، نمایاں۔
4421903	ممتاز، ممتاز۔
4421903	خاص طور پر.
4421903	ممتاز پرومیننٹ پرومیننٹ ایڈج
4421904	مفت فوٹو ای کارڈ بھیجیں۔
4421904	photo.net سے فوٹو ای کارڈز کسی کو آپ کے ذاتی سلام یا پیغام کے ساتھ photo.net گیلری کی تصویر ای میل کرنے کا ایک طریقہ ہے۔
4421904	photo.net پر اپنے پورٹ فولیو کا اعلان کرنے کے لیے اپنے رابطوں کو ای کارڈ بھیجیں۔
4421904	کسی دوسرے photo.net ممبر سے اس پر تنقید لکھنے کے لیے کہنے کے لیے اپنی ایک تصویر بطور ای کارڈ بھیجیں۔
4421905	چبانا کتے کے لیے کئی چیزوں کو پورا کرتا ہے۔
4421905	چھوٹے کتوں کے لیے، یہ درد کو دور کرنے کا ایک طریقہ ہے جو آنے والے دانتوں کی وجہ سے ہو سکتا ہے۔
4421905	بڑے کتوں کے لیے، جبڑوں کو مضبوط اور دانتوں کو صاف رکھنے کا یہ فطرت کا طریقہ ہے۔
4421906	بہترین طریقہ یہ یاد رکھنا ہے کہ کتوں کا چبانا فطری ہے۔
4421906	اپنے کتے کا پیچھا نہ کریں۔
4421906	بس اس کے پسند کے کھلونے کے لیے چپل کا تبادلہ کریں اور جب آپ تجارت کرتے ہیں تو کہیں، شکریہ، کتے!
4421906	آپ کا کتا اس کا کھیل بنا سکتا ہے اور آپ کے لیے چیزیں لانا شروع کر سکتا ہے۔
4421907	کتے اور چبانے والے کتے آپ کو پاگل بنا سکتے ہیں۔
4421907	لیکن ایسا گھر بنانا زیادہ مشکل نہیں ہے جہاں چبانے کی حوصلہ شکنی کی جائے۔
4421907	چبانے کو روکنے کے لیے تین آسان اقدامات کے لیے اس صفحہ کو چیک کریں۔
4421908	چبانا ہر عمر کے کتوں کے لیے بالکل عام طرز عمل ہے۔
4421908	جنگلی اور گھریلو کتے دونوں ہڈیوں کو چبانے میں گھنٹوں گزارتے ہیں۔
4421908	یہ سرگرمی ان کے جبڑوں کو مضبوط اور دانتوں کو صاف رکھتی ہے۔
4421908	کتے ہڈیوں، لاٹھیوں اور دستیاب کسی بھی چیز کو چبانا پسند کرتے ہیں۔
4421908	وہ تفریح کے لیے چباتے ہیں، محرک کے لیے چباتے ہیں، اور اضطراب کو دور کرنے کے لیے چباتے ہیں۔
4421909	چبانا بند کرنے کے لیے پہلے یہ کام کریں: 1.
4421909	اپنے گھٹنوں پر بیٹھ کر اور اپنے گھر کے ارد گرد دیکھ کر یہ دکھاوا کریں کہ آپ اپنے کتے ہیں۔
4421909	آپ کیا دیکھ رہے ہیں؟
4421909	کیا فرش پر ایسی چیزیں ہیں جو اگر آپ کتے ہوتے تو دلچسپ اور تفریحی ہوتیں؟
4421909	جوتے، پنسل، کاغذی کلپس، کپڑے، چپل وغیرہ کے بارے میں کیا خیال ہے؟
4421910	اگرچہ کتوں کو چیزوں کو چبانے کی ضرورت ہوتی ہے، لیکن نرم رہنمائی آپ کے کتے کو مناسب اشیاء جیسے اپنے کھلونوں کو چبانے تک محدود رکھنا سکھا سکتی ہے۔
4421910	براہ کرم عام چبانے کے رویے کے تحت مفید تجاویز دیکھیں، تاکہ آپ کے کتے کی چبانے کی خواہش کو صحیح سمت میں منتقل کیا جا سکے۔
4421911	جب کتے دانت دے رہے ہوتے ہیں، تو 3 سے 6 ماہ کی عمر کے درمیان، وہ بھی چبا رہے ہوتے ہیں!
4421911	آپ کے کتے کے بچے کے دانت ختم ہونے کے بعد، وہ عام طور پر وقت کے ساتھ چبانا بند کر دے گی، کیونکہ اس کے نئے دانتوں کی تکلیف ختم ہو چکی ہے۔
4421911	بڑے کتے بھی 6 ماہ اور ایک سال کے درمیان چبانے کے مرحلے سے گزر سکتے ہیں۔
4421912	کتے بعض اوقات نامناسب اشیاء کو چبا سکتے ہیں اگر کوئی بنیادی مسئلہ ہو جیسے اضطراب، مایوسی، بوریت وغیرہ۔
4421912	اس بات کو یقینی بنائیں کہ آپ کے کتے کو روزانہ کافی ورزش ہو، زیادہ تر کتوں کو ہر روز ڈاگ پارک میں کم از کم ایک چہل قدمی/دوڑ اور کافی صحبت اور ذہنی محرک کی ضرورت ہے۔
4421913	اسی طرح، کچھ کتے اور کتے کچرے پر چھاپہ مارنا اور ضائع شدہ سینیٹری نیپکن اور ٹیمپون چبانا پسند کرتے ہیں۔
4421913	یہ بہت خطرناک ہو سکتا ہے۔
4421913	اگر کوئی کتا سینیٹری آئٹم کھاتا ہے، تو یہ اس کے نظام ہاضمہ سے گزرتے ہوئے پھیل سکتا ہے۔
4421914	چبانا کتے کے عام رویے کا حصہ ہے۔
4421914	کتے چیزوں کو سونگھ کر اور چبا کر اپنے ماحول کی جانچ کرتے ہیں۔
4421914	کتے اپنے دانتوں کے مرحلے کے دوران بھی چباتے ہیں (جو تقریبا 12 ہفتوں کی عمر میں شروع ہوتا ہے) جب بچے کے دانتوں کو مستقل بالغ دانتوں سے تبدیل کیا جاتا ہے۔
4421915	حدود کا قانون قانون کی طرف سے عائد کردہ وقت کی حد سے مراد ہے جس میں مقدمہ یا مجرم دائر کیا جا سکتا ہے۔
4421915	یہ مدت ریاست کے لحاظ سے اور کیس کی قسم کے لحاظ سے مختلف ہوتی ہے۔
4421915	ایک بار جب قانون کے ذریعہ متعین کردہ وقت کی حد گزر جاتی ہے، تو مقدمہ یا مجرمانہ الزامات مزید دائر نہیں کیے جا سکتے۔
4421916	کسی بھی مجرمانہ استغاثہ کے لیے حدود کا کوئی قانون نہیں۔ فری کیس ریویو کے لیے مجرمانہ دفاع کے وکیل سے رابطہ کریں۔ حدود کا ایک قانون آپ کی بچت کا فضل ہو سکتا ہے، اگر یہ لاگو ہوتا ہے۔
4421917	حدود کا قانون۔
4421917	حدود کے قوانین وہ قوانین ہیں جو قانون ساز اداروں کے ذریعہ مشترکہ قانون کے نظام میں کسی واقعے کے بعد زیادہ سے زیادہ وقت طے کرنے کے لیے منظور کیے جاتے ہیں جس کے اندر قانونی کارروائی شروع کی جا سکتی ہے۔
4421917	جب حدود کے قانون میں متعین وقت کی مدت گزر جاتی ہے، تو دعوی مزید دائر نہیں کیا جاسکتا ہے، یا، اگر دائر کیا جاتا ہے، تو اسے ختم کرنے کا ذمہ دار ہوسکتا ہے اگر اس دعوے کے خلاف دفاع ہے، یا اس میں شامل ہے، کہ دعوی قانونی حدود کی مدت کے بعد دائر کیا گیا ہے۔
4421917	جب کسی مجرمانہ مقدمے میں حدود کا قانون ختم ہو جاتا ہے تو عدالتوں کا دائرہ اختیار ختم ہو جاتا ہے۔
4421917	زیادہ تر جرائم جن میں حدود کے قوانین ہوتے ہیں وہ سنگین جرائم سے ممتاز ہوتے ہیں کیونکہ یہ کسی بھی وقت لائے جا سکتے ہیں۔
4421918	جب حدود کے قانون میں متعین وقت کی مدت گزر جاتی ہے، تو دعوی مزید دائر نہیں کیا جاسکتا ہے، یا، اگر دائر کیا جاتا ہے، تو اسے ختم کرنے کا ذمہ دار ہوسکتا ہے اگر اس دعوے کا دفاع ہے، یا اس میں شامل ہے، کہ دعوی قانونی حدود کی مدت کے بعد دائر کیا گیا ہے۔
4421919	کلاسیکی ایتھنز میں، قتل اور غیر آئینی قوانین (جن کی کوئی حد نہیں تھی) کے علاوہ تمام مقدمات کے لیے حدود کا پانچ سالہ قانون قائم کیا گیا تھا۔
4421919	ڈیموستھینز نے لکھا ہے کہ حدود کے ان قوانین کو چاپلوسی (پیشہ ورانہ الزام لگانے والوں) پر قابو پانے کے لیے اپنایا گیا تھا۔
4421920	ایک اسکنک 31 دن کے لیے حاملہ ہوتی ہے، ایک چوہا/چوہا 21 دن کے لیے حاملہ ہوتا ہے، ایک ہمسٹر 16 دن کے لیے حاملہ ہوتا ہے، اور ایک اوپوسم 12 دن کے لیے حاملہ ہوتا ہے۔
4421920	بڑے جانور کئی سالوں تک حاملہ رہتے ہیں اور چھوٹے جانور چند مہینوں یا دنوں تک حاملہ رہتے ہیں۔
4421921	اعتماد کے ووٹ 8.9K ہیں۔
4421921	ایک سیاہ گینڈا عام طور پر 419 اور 478 دن، یا 15 سے 16 ماہ کے درمیان حاملہ ہوتا ہے۔
4421921	ماں ایک بچھڑے کو جنم دے گی، جس کا وزن اوسطا 35 سے 50 کلوگرام (تقریبا 80 پاؤنڈ) ہوگا۔
4421921	بچھڑا 2 سے 3 سال تک اپنی ماں کے ساتھ کہیں بھی رہے گا، اور بعض اوقات، اگر بچھڑا مادہ ہے تو وہ زیادہ دیر تک رہ سکتے ہیں، اور خواتین کا ایک خاندانی قسم کا گروہ تشکیل دے سکتے ہیں۔
4421921	مزید تفصیلات کے لیے، ذیل میں درج سائٹس دیکھیں۔
4421922	کالے پاؤں والی فیریٹ کتنی دیر تک حاملہ رہتی ہے؟
4421922	سیاہ پیر والے فیرٹ کا عام حمل 41 سے 43 دن کا ہوتا ہے، جو بہت سے عوامل پر منحصر ہوتا ہے، بشمول وہ کتنی کٹس لے کر جا رہی ہے۔
4421923	یہی وجہ ہے کہ یہ ہمیشہ ہمیں پریشان کرتا ہے کہ مکمل مدت کے حمل کی تعریف 9 ماہ ہے۔
4421923	40 ہفتوں یا اس سے زیادہ کے ساتھ ایک شخص کو بڑھانا، اور 4 ہفتوں سے ایک مہینے تک تھوڑا زیادہ خرچ کرنا، ہم 280 سے زیادہ دنوں کا پورا کریڈٹ چاہتے ہیں، براہ کرم۔
4421923	اب امریکن کالج آف آبسٹیٹریشن اینڈ گائنکولوجسٹ (اے سی او جی)، سوسائٹی فار میٹرن فیٹل میڈیسن کے ساتھ مل کر، وہ تبدیل کر رہا ہے جسے مکمل مدت سمجھا جاتا ہے۔
4421924	جانور کتنی دیر تک حاملہ رہتے ہیں۔
4421924	یہاں کچھ ایسے جانور ہیں جو سالوں یا مہینوں سے حاملہ ہیں۔
4421924	ایک ہندوستانی ہاتھی 624 دن کے لیے حاملہ ہے، ایک سیاہ گینڈا 504 دن کے لیے حاملہ ہے، ایک جراف 425 دن کے لیے حاملہ ہے، ایک سرمئی گینڈا 480 دن کے لیے حاملہ ہے، اور ایک اونٹ 400 دن کے لیے حاملہ ہے۔
4421925	گدھا 374 دن کے لیے، وہیل 360 دن کے لیے، گھوڑا 356 دن کے لیے، گائے 284 دن کے لیے، گریزلی ریچھ 220 دن کے لیے اور انسان 9 ماہ یا 266 دن کے لیے حاملہ ہوتا ہے۔
4421926	مارچ آف ڈائمز کے چیف میڈیکل آفیسر ڈاکٹر ایڈورڈ آر بی کا کہنا ہے کہ "[یہ] ایک خوش آئند رہنما اصول ہے جو اس الجھن کو ختم کرتا ہے کہ ایک غیر پیچیدہ، صحت مند حمل کتنی دیر تک رہنا چاہیے۔"
4421926	میک کیب۔
4421926	"یہ نئی تعریف تسلیم کرتی ہے کہ حمل کے ہر مرحلے پر بچوں کے لیے صحت کے منفی نتائج کا خطرہ بدلتا ہے۔
4421927	جب آپ گینڈے کی طرح محسوس کر رہے ہیں-ایک گینڈے کے ساتھ تربوز اس کے لیڈی پارٹس پر بیٹھا ہوا ہے-ایسا لگتا ہے جیسے آپ ہمیشہ کے لیے حاملہ ہیں۔
4421928	جبکہ اب تک 37 ہفتوں کو مکمل مدت سمجھا جاتا ہے، 39 سے 40 ہفتوں کی نئی تعریف ہے (37 سے 38 ہفتوں کو اب ابتدائی مدت سمجھا جائے گا)۔
4421928	تاخیر کی مدت اب 41 سے 42 ہفتوں تک ہے، اور 42 ہفتوں سے حاملہ غریب بدقسمت روحوں کو پوسٹ ٹرم کے طور پر درجہ بند کیا جائے گا۔
4421929	قلبی بیماری (CVD) بیماریوں کی ایک کلاس ہے جس میں دل یا خون شامل ہوتا ہے vessels.Cardiovascular بیماری میں کورونری شریانوں کی بیماریاں (CAD) جیسے انجائنا اور مایوکارڈیل انفکشن (جسے عام طور پر ہارٹ اٹیک کہا جاتا ہے) شامل ہیں۔
4421929	کورونری شریانوں کی بیماری (جسے کورونری دل کی بیماری اور اسکیمک دل کی بیماری بھی کہا جاتا ہے)۔
4421929	2 پردیی شریانوں کی بیماری-خون کی رگوں کی بیماری جو بازوؤں اور ٹانگوں کو خون کی فراہمی کرتی ہے۔
4421929	3 سیریبرووسکولر بیماری-خون کی شریانوں کی بیماری جو دماغ کو خون کی فراہمی کرتی ہے (بشمول فالج)۔
4421930	اس کے نام سے بھی جانا جاتا ہے: سی وی ڈی۔
4421930	قلبی بیماری (سی وی ڈی) ایک عام اصطلاح ہے جو ان عوارض کو بیان کرنے کے لیے استعمال ہوتی ہے جو دل (کارڈیو) اور/یا جسم کے خون کی شریانوں کے نظام (ویسکولر) کو متاثر کر سکتے ہیں۔ زیادہ تر قلبی بیماریاں دائمی حالات کی عکاسی کرتی ہیں-وہ حالات جو time.n کے اضافے کی طویل مدت تک ترقی کرتے ہیں یا برقرار رہتے ہیں، کچھ خطرے کے عوامل ہیں جن پر قابو نہیں پایا جا سکتا، بشمول عمر، جنس اور خاندانی تاریخ: 1 CVD کا خطرہ عمر کے ساتھ بڑھتا ہے۔
4421930	2 مردوں کو عام طور پر دل کی بیماری کا زیادہ خطرہ ہوتا ہے ؛ تاہم، خواتین کا خطرہ مردوں کے رجونورتی کے بعد بڑھ جاتا ہے۔
4421931	کارڈیو ویسکولر: گردش کے نظام سے متعلق، جو دل اور خون کی وریدوں پر مشتمل ہوتا ہے اور جسم کے بافتوں تک غذائی اجزاء اور آکسیجن پہنچاتا ہے اور them.ardiovascular سے کاربن ڈائی آکسائیڈ اور دیگر فضلے کو ہٹاتا ہے: گردش کے نظام سے متعلق، جو دل اور خون کی وریدوں پر مشتمل ہوتا ہے اور جسم کے بافتوں تک غذائی اجزاء اور آکسیجن پہنچاتا ہے اور ان میں سے کاربن ڈائی آکسائیڈ اور دیگر فضلے کو نکالتا ہے۔
4421932	امریکن ہارٹ ایسوسی ایشن-اسٹروک ایسوسی ایشن نے جواب دیا۔
4421932	کارڈیو ویسکولر کا مطلب ہے "دل اور خون کی شریانوں سے متعلق یا اس سے متعلق"۔
4421932	("کارڈیو" کا مطلب ہے دل ؛ "ویسکولر" کا مطلب ہے خون کی نالیاں۔)
4421932	دل اور خون کی شریانوں کا گردشی نظام قلبی نظام ہے۔
4421932	امریکن ہارٹ ایسوسی ایشن-اسٹروک ایسوسی ایشن نے جواب دیا۔
4421932	کارڈیو ویسکولر کا مطلب ہے "دل اور خون کی شریانوں سے متعلق یا اس سے متعلق"۔
4421932	("کارڈیو" کا مطلب ہے دل ؛ "ویسکولر" کا مطلب ہے خون کی نالیاں۔)
4421932	دل اور خون کی شریانوں کا گردشی نظام قلبی نظام ہے۔
4421933	دل کی بیماری کی اصطلاح اکثر قلبی بیماری کی اصطلاح کے ساتھ ایک دوسرے کے متبادل کے طور پر استعمال ہوتی ہے۔ قلبی بیماری عام طور پر ان حالات سے مراد ہے جن میں خون کی نالیاں تنگ یا بند ہو جاتی ہیں جو دل کے دورے، سینے میں درد (انجائنا) یا stroke.eart بیماری کا باعث بن سکتی ہیں جو آپ کے دل کو متاثر کرنے والے متعدد حالات کو بیان کرتی ہیں۔
4421933	دل کی بیماری کی چھتری کے نیچے کی بیماریوں میں خون کی شریانوں کی بیماریاں شامل ہیں، جیسے کہ کورونری شریانوں کی بیماری ؛ دل کی تال کے مسائل (اریتھمیا) ؛ اور دل کے نقائص جن کے ساتھ آپ پیدا ہوئے ہیں (پیدائشی دل کے نقائص)، دوسروں کے درمیان۔
4421934	اسم کارڈیوواسکلر بیماری کا 1 احساس ہے: 1. دل یا خون کی شریانوں کی بیماری۔
4421934	واقفیت کی معلومات: کارڈیوواسکلر بیماری جسے اسم کے طور پر استعمال کیا جاتا ہے وہ بہت ہی rare.eaning ہے: دل یا خون کی شریانوں کی بیماری۔
4421934	درجہ بندی کے تحت: مستحکم حالات کی نشاندہی کرنے والے اسم۔
4421934	ہائپرنیمز (قلبی بیماری ایک قسم کی...): عارضہ ؛ پریشان (ایسی حالت جس میں معمول کے کام میں خلل پڑتا ہے)۔
4421935	کورونری دل کی بیماری (سی ایچ ڈی) اس وقت ہوتی ہے جب آپ کے دل میں آکسیجن سے بھرپور خون کا بہاؤ کورونری شریانوں میں چربی والے مواد (ایتھروما) کی تعمیر سے رک جاتا ہے یا کم ہو جاتا ہے۔
4421935	کورونری شریانیں خون کی دو بڑی شریانیں ہیں جو آپ کے دل کو blood.oronary دل کی بیماری (CHD) کی فراہمی کرتی ہیں جب آپ کے دل میں آکسیجن سے بھرپور خون کا بہاؤ کورونری شریانیں میں چربی والے مواد (ایتھروما) کی تعمیر سے رک جاتا ہے یا کم ہو جاتا ہے۔
4421935	کورونری شریانیں خون کی دو بڑی شریانیں ہیں جو آپ کے دل کو خون فراہم کرتی ہیں۔
4421936	1 ایروسول اسسٹڈ سی وی ڈی (اے اے سی وی ڈی)-سی وی ڈی جس میں پیشروؤں کو مائع/گیس ایروسول کے ذریعے سبسٹریٹ تک پہنچایا جاتا ہے، جسے الٹراسونک طور پر تیار کیا جا سکتا ہے۔
4421936	2 یہ تکنیک غیر مستحکم precursors.VD کے ساتھ استعمال کے لیے موزوں ہے جس پر مختلف فارمیٹس میں عمل کیا جاتا ہے۔
4421936	یہ عمل عام طور پر ان ذرائع میں مختلف ہوتے ہیں جن کے ذریعے کیمیائی تعاملات شروع ہوتے ہیں۔
4421936	1 آپریٹنگ دباؤ کے لحاظ سے درجہ بندی: 2 ماحولیاتی دباؤ سی وی ڈی (اے پی سی وی ڈی)-ماحولیاتی دباؤ پر سی وی ڈی۔
4421937	یہ اندازہ لگایا گیا ہے کہ 90 فیصد سی وی ڈی کو روکا جا سکتا ہے۔
4421937	ایٹروسکلروسیس کی روک تھام خطرے کے عوامل کو کم کرنے کے ذریعے ہوتی ہے: صحت مند کھانا، ورزش، تمباکو کے دھوئیں سے بچنا اور شراب کی مقدار کو محدود کرنا۔
4421937	ہائی بلڈ پریشر اور ذیابیطس کا علاج بھی فائدہ مند ہے۔
4421937	کورونری شریانوں کی بیماری (جسے کورونری دل کی بیماری اور اسکیمک دل کی بیماری بھی کہا جاتا ہے)۔
4421937	2 پردیی شریانوں کی بیماری-خون کی رگوں کی بیماری جو بازوؤں اور ٹانگوں کو خون کی فراہمی کرتی ہے۔
4421937	3 سیریبرووسکولر بیماری-خون کی شریانوں کی بیماری جو دماغ کو خون کی فراہمی کرتی ہے (بشمول فالج)۔
4421938	اسٹروک ایک "دماغی حملہ" ہے جو دماغ میں خون کے بہاؤ کی کمی کی وجہ سے ہوتا ہے۔
4421938	خون کو دل سے دماغ تک پہنچایا جاتا ہے۔
4421938	شریانیں یا خون کی نالیاں۔
4421938	دماغ کو خون کی مستقل فراہمی کی ضرورت ہوتی ہے۔
4421938	خون آسانی سے بہہ جاتا ہے۔
4421938	ایک عام، صاف شریان کے ذریعے۔
4421938	جب دماغ کی شریانوں میں سے ایک یا تو ہوتی ہے۔
4421938	بند ہو جاتا ہے یا پھٹ جاتا ہے، دماغ کو دماغ نہیں ملتا ہے۔
4421938	خون کو کام کرنے کی ضرورت ہوتی ہے اور دماغ کے خلیات مر جاتے ہیں۔
4421938	بہت سی ایسی چیزیں ہیں جو خون کے بہاؤ کو متاثر کر سکتی ہیں۔
4421939	دماغ کے خون کے بہاؤ میں کمی چکر آنا، ہلکا سر درد، اور بعض اوقات شعور کی کمی کا باعث بن سکتی ہے۔
4421939	یہ تیزی سے اٹھنے پر ہو سکتا ہے کیونکہ کشش ثقل کی وجہ سے پیٹ اور ٹانگوں میں خون جمع ہو جاتا ہے اگر کوئی چیز معمول کے طریقہ کار میں خلل ڈالتی ہے جو خون کو دل اور دماغ تک واپس لانے میں مدد کرتی ہے۔
4421940	دماغی خون کا بہاؤ، کاربن ڈائی آکسائیڈ، اور آرتھوسٹاسس۔
