4422434	برٹن کا ڈیوک چلڈرن ہسپتال کے ساتھ دیرینہ تعلق ہے۔
4422435	نیسکار کپ ریس میں کینٹکی اسپیڈ وے پر 43 کاریں نہیں ہوں گی۔
4422435	سپارٹا، کی۔-کسی بھی پرستار سے پوچھیں کہ نیسکار کی دوڑ میں کتنے ڈرائیور ہیں اور وہ فوری طور پر جواب دیں گے: 43۔
4422435	یہ 1998 سے ایسا ہی رہا ہے، جب NASCAR نے ٹریک کی بنیاد پر پہلے اتار چڑھاؤ کے بعد ہر ریس کے لیے فیلڈ سائز کو معیاری بنایا تھا۔
4422435	لیکن کینٹکی سپیڈ وے پر ہفتہ کی رات ایسا نہیں ہوگا۔
4422435	11 ستمبر کے دہشت گردانہ حملوں کی وجہ سے 2001 کی نیو ہیمپشائر موٹر اسپیڈوے ریس منتقل ہونے کے بعد پہلی بار، کویکر اسٹیٹ 400 کو شروع کرنے کے لیے صرف 42 کاریں ہوں گی۔
4422435	تاہم، نیسکار کو یقین نہیں ہے کہ ایک چھوٹا میدان کھیل کی صحت پر فرد جرم ہے۔
4422436	NASCAR ایک سال سے زیادہ عرصے سے ایک مختصر میدان کے ساتھ چھیڑ چھاڑ کر رہا ہے۔
4422436	Jayski.com کے مطابق، 2004-2012 سے چار بار صرف 43 کاریں ریس میں داخل ہوئیں۔
4422436	یہ تعداد صرف پچھلے سیزن میں 36 ریسوں میں سے 22 تک پہنچ گئی۔
4422437	نیسکار کے ڈرائیور مختلف وجوہات کی بناء پر آگے بڑھ رہے ہیں۔
4422437	خود سے کم خوش قسمت لوگوں کی حمایت کرنا ڈرائیوروں اور خود منظوری دینے والے ادارے کے درمیان ایک بڑھتی ہوئی طاقت بن گیا ہے، جو...
4422437	کے ذریعے ان بنیادوں اور اپنے اقدامات کو قبول کرتا ہے۔
4422437	نیسکار فاؤنڈیشن۔
4422437	عملی طور پر ہر کپ ڈرائیور کسی نہ کسی قسم میں ملوث رہا ہے
4422438	بلاشبہ، نیسکار سپرنٹ کپ ڈرائیوروں کے پاس کھیل کے سب سے زیادہ مصروف شیڈول ہوتے ہیں۔
4422438	بس یہ دیکھیں کہ وہ ہفتہ وار کیا انجام دیتے ہیں۔
4422438	وہ نہ صرف بنیادی طور پر تین روزہ ریس کے اختتام ہفتہ کے لیے پورے ملک میں اچھالتے ہیں، بلکہ وہ ذمہ داریوں کو بھی دیکھتے ہیں جو ان کے بقیہ فارغ لمحات کو منڈواتے ہیں۔
4422439	کینٹکی اسپیڈ وے سپارٹا، کی۔ میں نیسکار کپ ریس میں 43 کاریں نہیں ہوں گی۔-کسی بھی پرستار سے پوچھیں کہ نیسکار ریس میں کتنے ڈرائیور ہیں اور انہیں فوری طور پر جواب معلوم ہو جائے گا: 43۔
4422439	یہ 1998 سے ایسا ہی رہا ہے، جب NASCAR نے اس کے بعد ہر ریس کے لیے فیلڈ سائز کو معیاری بنایا۔
4422440	نیسکار کپ ریس میں کینٹکی اسپیڈ وے پر 43 کاریں نہیں ہوں گی۔
4422440	سپارٹا، کی۔-کسی بھی پرستار سے پوچھیں کہ نیسکار ریس میں کتنے ڈرائیور ہیں اور انہیں فوری طور پر جواب معلوم ہو جائے گا: 43۔
4422440	یہ 1998 سے ایسا ہی رہا ہے، جب NASCAR نے اس کے بعد ہر ریس کے لیے فیلڈ سائز کو معیاری بنایا۔
4422441	ماخذ: عمر اسق باہر نکلنا چاہیں گے۔
4422441	عمر اسک، ہیوسٹن راکٹس کا رہائشی ابتدائی مرکز، اب یہ جاننا چاہے گا کہ ڈوائٹ ہاورڈ نے مفت ایجنسی میں راکٹس میں شامل ہونے کا فیصلہ کیا ہے۔
4422441	ہاورڈ نے جمعہ کی رات ٹویٹر کے ذریعے تصدیق کی کہ وہ راکٹوں کے ساتھ دستخط کریں گے۔
4422442	آسک گردش میں ہونے کے قریب نہیں ہے، لیکن پیلیکن جسم کو ڈیمارکس کزنز کے ساتھ استعمال کر سکتے تھے۔
4422442	انتھونی ڈیوس بدھ کو بہت زیادہ سینٹر کھیلنے جا رہے ہیں جو ڈوناٹاس موتیجناس کے لیے منٹ کھول سکتا ہے۔
4422443	لیکن جب او نیل سے 7 فٹ کے مرکز عمر اسک سے شروع ہونے والے نیو اورلینز پیلیکنز کے کھیل کا جائزہ لینے کے لیے کہا گیا تو وہ پیچھے نہیں ہٹے۔
4422443	او نیل نے کہا، "وہ ایک مختلف قسم کا کھلاڑی ہے۔"
